{
  "$schema": "https://json-schema.org/draft/2020-12/schema",
  "$id": "https://github.com/charly-vibes/nayra/event.schema.json",
  "title": "Nayra Event",
  "description": "Schema for timeline event data in Nayra",
  "type": "object",
  "required": ["id", "start", "label"],
  "properties": {
    "id": {
      "type": "string",
      "minLength": 1,
      "description": "Unique identifier for the event"
    },
    "start": {
      "$ref": "#/$defs/timeString"
    },
    "label": {
      "type": "string",
      "description": "Short display title (recommended <100 characters)"
    },
    "end": {
      "$ref": "#/$defs/timeString"
    },
    "description": {
      "type": "string",
      "description": "Longer description, supports markdown"
    },
    "category": {
      "type": "string",
      "description": "Primary classification for coloring (e.g., 'war', 'science')"
    },
    "tags": {
      "type": "array",
      "items": {
        "type": "string"
      },
      "default": [],
      "description": "Secondary classification for filtering"
    },
    "priority": {
      "type": "number",
      "minimum": 0,
      "maximum": 4,
      "default": 2,
      "description": "Display priority 0-4 (0=critical, 4=background)"
    },
    "precision": {
      "type": "string",
      "enum": ["day", "month", "year", "decade", "century", "million_years", "billion_years"],
      "description": "Date precision for display formatting"
    },
    "url": {
      "type": "string",
      "format": "uri",
      "description": "Link to more information"
    },
    "source": {
      "type": "string",
      "description": "Data provenance (e.g., 'wikidata:Q12345')"
    },
    "metadata": {
      "type": "object",
      "default": {},
      "description": "Arbitrary key-value pairs for extensions"
    }
  },
  "additionalProperties": false,
  "$defs": {
    "timeString": {
      "type": "string",
      "minLength": 1,
      "description": "Time value in supported formats: ISO 8601, year only, BCE/BC, CE/AD, Ma/Ga",
      "examples": ["2024-03-15", "1969", "-44", "44 BCE", "1066 CE", "65 Ma", "4.5 Ga"]
    }
  }
}
