[
  {
    "id": "gobekli-tepe",
    "start": "10000 BCE",
    "label": "Year 0 HE: Göbekli Tepe",
    "description": "Construction of the world's first temple in modern-day Turkey. Hunter-gatherers gather to build a massive stone monument, marking the start of the Human Era (HE).",
    "category": "humanity",
    "tags": ["temple", "engineering", "kurzgesagt"],
    "priority": 0
  },
  {
    "id": "jericho",
    "start": "9000 BCE",
    "label": "Year 1,000 HE: First City Walls",
    "description": "Jericho begins to take shape as one of the first permanent human settlements with stone walls.",
    "category": "humanity",
    "tags": ["settlement", "jericho", "kurzgesagt"]
  },
  {
    "id": "agriculture",
    "start": "8000 BCE",
    "label": "Year 2,000 HE: Agriculture Widespread",
    "description": "Humans transition from nomadic lifestyles to permanent farming. The global population is roughly 5 million.",
    "category": "humanity",
    "tags": ["farming", "revolution", "kurzgesagt"]
  },
  {
    "id": "pottery",
    "start": "7000 BCE",
    "label": "Year 3,000 HE: Pottery & Storage",
    "description": "Widespread use of pottery allows for better food storage and early industrial production.",
    "category": "humanity",
    "tags": ["technology", "kurzgesagt"]
  },
  {
    "id": "metalworking",
    "start": "6000 BCE",
    "label": "Year 4,000 HE: Early Metalworking",
    "description": "Humans begin processing copper and tin, leading to the first metal tools.",
    "category": "humanity",
    "tags": ["metalworking", "copper", "kurzgesagt"]
  },
  {
    "id": "writing-wheel",
    "start": "3000 BCE",
    "label": "Year 7,000 HE: Writing & The Wheel",
    "description": "Invention of writing in Sumer and Egypt. The wheel is developed for transport. Construction of the Great Pyramid and Stonehenge begins.",
    "category": "humanity",
    "tags": ["writing", "wheel", "pyramids", "kurzgesagt"],
    "priority": 0
  },
  {
    "id": "iron-age",
    "start": "1500 BCE",
    "label": "Year 8,500 HE: The Iron Age",
    "description": "Iron replaces bronze, leading to more durable tools and larger-scale civilizations.",
    "category": "humanity",
    "tags": ["iron", "technology", "kurzgesagt"]
  },
  {
    "id": "classical-age",
    "start": "500 BCE",
    "label": "Year 9,500 HE: The Classical Age",
    "description": "Rise of Greek city-states, the Persian Empire, and the teachings of Buddha and Confucius.",
    "category": "humanity",
    "tags": ["philosophy", "empires", "kurzgesagt"]
  },
  {
    "id": "year-1-ce",
    "start": "1 CE",
    "label": "Year 10,000 HE: Common Era Begins",
    "description": "The traditional Year 1 of the Gregorian calendar. By this point, 10,000 years of human progress have already passed.",
    "category": "humanity",
    "tags": ["calendar", "history", "kurzgesagt"],
    "priority": 1
  },
  {
    "id": "industrial-revolution",
    "start": "1750 CE",
    "label": "Year 11,750 HE: Industrial Revolution",
    "description": "Steam power and factories fundamentally change the human relationship with the planet.",
    "category": "humanity",
    "tags": ["industry", "technology", "kurzgesagt"]
  },
  {
    "id": "moon-landing",
    "start": "1969 CE",
    "label": "Year 11,969 HE: Moon Landing",
    "description": "Apollo 11: Humans leave Earth and set foot on another celestial body for the first time.",
    "category": "humanity",
    "tags": ["space", "moon", "kurzgesagt"],
    "priority": 0
  },
  {
    "id": "digital-age",
    "start": "2000 CE",
    "label": "Year 12,000 HE: The Digital Age",
    "description": "The rise of the Internet and global digital connectivity.",
    "category": "humanity",
    "tags": ["internet", "computing", "kurzgesagt"]
  },
  {
    "id": "today-he",
    "start": "today",
    "label": "Year 12,026 HE: Today",
    "description": "We live in the most prosperous and technologically advanced age in human history.",
    "category": "humanity",
    "tags": ["current", "progress", "kurzgesagt"],
    "priority": 0
  }
]
