[
  {
    "id": "Q362",
    "start": "1939-09-01",
    "end": "1945-09-02",
    "label": "World War II",
    "description": "Global war that lasted from 1939 to 1945",
    "category": "military conflict",
    "source": "wikidata:Q362",
    "url": "https://en.wikipedia.org/wiki/World_War_II",
    "precision": "day"
  },
  {
    "id": "Q361",
    "start": "1914-07-28",
    "end": "1918-11-11",
    "label": "World War I",
    "description": "Global war originating in Europe that lasted from 1914 to 1918",
    "category": "military conflict",
    "source": "wikidata:Q361",
    "url": "https://en.wikipedia.org/wiki/World_War_I",
    "precision": "day"
  },
  {
    "id": "Q8683",
    "start": "1861-04-12",
    "end": "1865-05-09",
    "label": "American Civil War",
    "description": "Civil war in the United States between the Union and the Confederacy",
    "category": "civil war",
    "source": "wikidata:Q8683",
    "url": "https://en.wikipedia.org/wiki/American_Civil_War",
    "precision": "day"
  },
  {
    "id": "Q6534",
    "start": "264 BCE",
    "label": "Punic Wars Begin",
    "description": "Series of three wars between Rome and Carthage (264-146 BCE)",
    "category": "military conflict",
    "source": "wikidata:Q6534",
    "precision": "year"
  },
  {
    "id": "Q81545",
    "start": "1337",
    "end": "1453",
    "label": "Hundred Years' War",
    "description": "Series of armed conflicts between England and France during the Late Middle Ages",
    "category": "military conflict",
    "source": "wikidata:Q81545",
    "url": "https://en.wikipedia.org/wiki/Hundred_Years%27_War",
    "precision": "year"
  },
  {
    "id": "Q8740",
    "start": "1950-06-25",
    "end": "1953-07-27",
    "label": "Korean War",
    "description": "War between North Korea and South Korea from 1950 to 1953",
    "category": "military conflict",
    "source": "wikidata:Q8740",
    "url": "https://en.wikipedia.org/wiki/Korean_War",
    "precision": "day"
  },
  {
    "id": "Q8726",
    "start": "1955-11-01",
    "end": "1975-04-30",
    "label": "Vietnam War",
    "description": "Conflict in Vietnam, Laos, and Cambodia from 1955 to 1975",
    "category": "military conflict",
    "source": "wikidata:Q8726",
    "url": "https://en.wikipedia.org/wiki/Vietnam_War",
    "precision": "day"
  }
]
